Text,Subfield,Job Title
I develop microservices architecture using Node.js and Docker for scalable web applications.,Computer Science,Software Engineer
"I specialize in frontend development with React and Angular, creating responsive user interfaces.",Computer Science,Software Engineer
"I work on cloud-based solutions using AWS and Azure, implementing CI/CD pipelines for continuous deployment.",Computer Science,Software Engineer
I focus on mobile app development using Flutter and React Native for cross-platform compatibility.,Computer Science,Software Engineer
I implement RESTful APIs and GraphQL endpoints to support modern web applications.,Computer Science,Software Engineer
I build computer vision systems using OpenCV and deep learning for object detection and recognition.,Computer Science,Machine Learning Engineer
I develop natural language processing models for sentiment analysis and text classification.,Computer Science,Machine Learning Engineer
I create recommendation engines using collaborative filtering and content-based approaches.,Computer Science,Machine Learning Engineer
I work on reinforcement learning algorithms for autonomous decision-making systems.,Computer Science,Machine Learning Engineer
I implement time series forecasting models for financial and weather prediction applications.,Computer Science,Machine Learning Engineer
I develop embedded systems using C and Assembly for IoT devices and microcontrollers.,Computer Science,Programmer
I specialize in algorithm optimization and data structures to improve software performance.,Computer Science,Programmer
I create database queries and stored procedures using SQL for efficient data retrieval.,Computer Science,Programmer
I work on functional programming using languages like Haskell and Scala for reliable systems.,Computer Science,Programmer
I develop automation scripts and tools using Python to streamline development workflows.,Computer Science,Programmer
I develop distributed systems that can handle millions of concurrent users with high availability.,Computer Science,Software Engineer
I implement test-driven development practices and maintain high test coverage in our codebase.,Computer Science,Software Engineer
"I specialize in refactoring legacy codebases into modern, maintainable architecture.",Computer Science,Software Engineer
I work on real-time processing systems using technologies like Kafka and RabbitMQ.,Computer Science,Software Engineer
I develop secure authentication and authorization systems following OWASP security best practices.,Computer Science,Software Engineer
I provide desktop support and troubleshoot hardware issues across multiple office locations.,IT,IT Support Specialist
I manage user accounts and access permissions across corporate systems and applications.,IT,IT Support Specialist
"I set up and configure workstations, printers, and peripherals for new employees.",IT,IT Support Specialist
I create and maintain IT documentation including user guides and standard operating procedures.,IT,IT Support Specialist
I handle software licensing and ensure all company systems are properly licensed and updated.,IT,IT Support Specialist
"I manage cloud infrastructure on AWS, setting up virtual networks and security groups.",IT,Network Administrator
I configure and maintain network monitoring tools to ensure optimal performance and uptime.,IT,Network Administrator
I implement and manage active directory services and group policies for network security.,IT,Network Administrator
I design and implement disaster recovery solutions including backup systems and failover protocols.,IT,Network Administrator
I optimize network traffic using load balancers and traffic shaping technologies.,IT,Network Administrator
I conduct feasibility studies for new IT systems and provide recommendations based on business needs.,IT,Systems Analyst
I develop system documentation and specifications for developers to implement.,IT,Systems Analyst
I perform quality assurance testing to ensure systems meet technical and business requirements.,IT,Systems Analyst
I analyze system logs and performance metrics to identify bottlenecks and areas for improvement.,IT,Systems Analyst
I facilitate workshops to gather requirements and validate system designs with stakeholders.,IT,Systems Analyst
I conduct security assessments and audits to ensure compliance with industry standards and regulations.,IT,Cybersecurity Expert
I implement intrusion detection and prevention systems to protect against network threats.,IT,Cybersecurity Expert
I develop and enforce security policies and procedures for the organization.,IT,Cybersecurity Expert
I perform incident response and forensic analysis for security breaches and suspicious activities.,IT,Cybersecurity Expert
I conduct security awareness training for employees to minimize human-related security risks.,IT,Cybersecurity Expert
I conduct gap analysis between current and desired business processes to identify improvement opportunities.,Information Systems,Business Analyst
I create detailed business requirements documents and user stories for development teams.,Information Systems,Business Analyst
I facilitate JAD (Joint Application Development) sessions to align stakeholder expectations.,Information Systems,Business Analyst
I develop use cases and process flow diagrams to document system functionality.,Information Systems,Business Analyst
I perform cost-benefit analysis for proposed system changes and enhancements.,Information Systems,Business Analyst
"I manage Agile development teams, facilitating daily standups and sprint planning meetings.",Information Systems,IT Project Manager
I create and maintain project documentation including project charters and status reports.,Information Systems,IT Project Manager
I identify and mitigate project risks through proactive planning and stakeholder management.,Information Systems,IT Project Manager
I manage vendor relationships and ensure contracted deliverables meet quality standards.,Information Systems,IT Project Manager
I implement project management methodologies like PRINCE2 and PMI frameworks.,Information Systems,IT Project Manager
"I configure and customize SAP modules for finance, HR, and supply chain management.",Information Systems,ERP Specialist
I perform data migration and integration between legacy systems and new ERP implementations.,Information Systems,ERP Specialist
I troubleshoot ERP system issues and develop solutions to minimize business disruption.,Information Systems,ERP Specialist
I conduct user acceptance testing for ERP modules before deployment to production.,Information Systems,ERP Specialist
I develop custom reports and dashboards using ERP reporting tools like SAP BusinessObjects.,Information Systems,ERP Specialist
I create data models and entity relationship diagrams to represent business information structures.,Information Systems,Business Analyst
I perform business process reengineering to optimize workflows and eliminate inefficiencies.,Information Systems,Business Analyst
I develop KPIs and metrics to measure the success of implemented business solutions.,Information Systems,Business Analyst
I conduct competitive analysis to identify market trends and opportunities for technology implementation.,Information Systems,Business Analyst
I validate system designs against business requirements to ensure alignment with objectives.,Information Systems,Business Analyst
I implement physics engines and collision detection systems for realistic game mechanics.,Entertainment and Multimedia Computing,Game Developer
I develop procedural content generation algorithms for dynamic game worlds and levels.,Entertainment and Multimedia Computing,Game Developer
I optimize game performance across different hardware configurations and platforms.,Entertainment and Multimedia Computing,Game Developer
I implement multiplayer networking code for real-time online gameplay.,Entertainment and Multimedia Computing,Game Developer
I develop AI systems for non-player characters with realistic behaviors and pathfinding.,Entertainment and Multimedia Computing,Game Developer
I create photorealistic textures and materials using PBR (Physically Based Rendering) techniques.,Entertainment and Multimedia Computing,Multimedia Artist
"I develop particle effects and visual simulations for explosions, fire, and weather effects.",Entertainment and Multimedia Computing,Multimedia Artist
I design user interfaces and interactive elements for games and multimedia applications.,Entertainment and Multimedia Computing,Multimedia Artist
I create cinematic sequences and cutscenes for storytelling in video games.,Entertainment and Multimedia Computing,Multimedia Artist
I develop concept art and storyboards to visualize game environments and characters.,Entertainment and Multimedia Computing,Multimedia Artist
I create skeletal rigs for character animation with inverse kinematics and constraints.,Entertainment and Multimedia Computing,Technical Animator
I develop facial animation systems for realistic expressions and lip-syncing.,Entertainment and Multimedia Computing,Technical Animator
I implement procedural animation systems for dynamic movement and interactions.,Entertainment and Multimedia Computing,Technical Animator
I optimize animation systems for real-time performance in game engines.,Entertainment and Multimedia Computing,Technical Animator
I create animation state machines and blend trees for smooth character transitions.,Entertainment and Multimedia Computing,Technical Animator
I develop virtual reality experiences with immersive interactions and gameplay.,Entertainment and Multimedia Computing,Game Developer
I implement shaders and rendering techniques for realistic lighting and visual effects.,Entertainment and Multimedia Computing,Game Developer
I create tools and pipelines to streamline game development workflows.,Entertainment and Multimedia Computing,Game Developer
I develop mobile games with touch controls and device-specific optimizations.,Entertainment and Multimedia Computing,Game Developer
I implement save systems and game progression mechanics for player retention.,Entertainment and Multimedia Computing,Game Developer
I develop and maintain digital repositories for academic research and publications.,Library and Information Science,Digital Librarian
I implement metadata standards like Dublin Core and MODS for digital collections.,Library and Information Science,Digital Librarian
I design and conduct user studies to improve digital library interfaces and accessibility.,Library and Information Science,Digital Librarian
I manage digital preservation strategies to ensure long-term access to electronic materials.,Library and Information Science,Digital Librarian
I develop collection development policies for digital resources and databases.,Library and Information Science,Digital Librarian
I conduct card sorting exercises to determine optimal information categorization schemes.,Library and Information Science,Information Architect
I develop taxonomies and controlled vocabularies for content management systems.,Library and Information Science,Information Architect
I create wireframes and prototypes to test information navigation patterns.,Library and Information Science,Information Architect
I perform content audits and inventories to organize existing information resources.,Library and Information Science,Information Architect
I implement search functionality and faceted navigation for information discovery.,Library and Information Science,Information Architect
I develop classification schemes and filing systems for organizational records.,Library and Information Science,Records Manager
I implement electronic document management systems for efficient records retrieval.,Library and Information Science,Records Manager
I conduct records audits to ensure compliance with regulatory requirements.,Library and Information Science,Records Manager
I develop disaster recovery plans for vital records and information assets.,Library and Information Science,Records Manager
I train staff on records management procedures and documentation practices.,Library and Information Science,Records Manager
I implement search optimization techniques to improve resource discovery in digital collections.,Library and Information Science,Digital Librarian
I develop data curation workflows for managing research datasets and associated metadata.,Library and Information Science,Digital Librarian
I create digital exhibits and online showcases for special collections and archives.,Library and Information Science,Digital Librarian
I implement linked data and semantic web technologies for connecting digital resources.,Library and Information Science,Digital Librarian
"I conduct digitization projects, converting physical materials to accessible digital formats.",Library and Information Science,Digital Librarian
